{
  "task_id": "p2-dev-en-01",
  "language": "en",
  "domain": "science_health",
  "complexity": "moderate",
  "query": "Explain how to compare two home air-quality interventions for particulate matter, including evidence quality, measurement design, and important limitations.",
  "requirements": [
    {
      "id": "r01",
      "text": "Compare filtration and source-control interventions"
    },
    {
      "id": "r02",
      "text": "Describe a credible particulate-matter measurement design"
    },
    {
      "id": "r03",
      "text": "Explain evidence-quality and interpretation limitations"
    }
  ],
  "candidates": [
    {
      "candidate_id": "c01",
      "url": "https://phase2-dev-p2-dev-en-01-1.test/document",
      "title": "Portable filtration",
      "domain": "phase2-dev-1.test",
      "published_at_if_observable": null,
      "content": "A correctly sized particle filter can reduce indoor particulate concentrations while operating. Performance depends on clean-air delivery rate, room volume, placement, fan setting, filter loading, and outdoor infiltration. The document is synthetic and was authored only for development-set harness testing; it is not scored benchmark evidence.",
      "content_chars": 344
    },
    {
      "candidate_id": "c02",
      "url": "https://phase2-dev-p2-dev-en-01-2.test/document",
      "title": "Source control",
      "domain": "phase2-dev-2.test",
      "published_at_if_observable": null,
      "content": "Removing indoor emission sources and reducing particle entry can prevent pollution rather than treating it after release. Effects vary with cooking, smoking, ventilation behavior, building leakage, and outdoor conditions. The document is synthetic and was authored only for development-set harness testing; it is not scored benchmark evidence.",
      "content_chars": 343
    },
    {
      "candidate_id": "c03",
      "url": "https://phase2-dev-p2-dev-en-01-3.test/document",
      "title": "Measurement design",
      "domain": "phase2-dev-3.test",
      "published_at_if_observable": null,
      "content": "Use calibrated sensors in comparable locations, establish a baseline, record intervention periods, and track outdoor particulate matter, occupancy, ventilation, and episodic sources. Repeated measurements are stronger than one before-after reading. The document is synthetic and was authored only for development-set harness testing; it is not scored benchmark evidence.",
      "content_chars": 370
    },
    {
      "candidate_id": "c04",
      "url": "https://phase2-dev-p2-dev-en-01-4.test/document",
      "title": "Evidence limits",
      "domain": "phase2-dev-4.test",
      "published_at_if_observable": null,
      "content": "Sensor error, temporal confounding, room differences, adherence, and short follow-up can exaggerate an apparent effect. Lower particle concentration is an intermediate outcome and does not by itself prove a health benefit. The document is synthetic and was authored only for development-set harness testing; it is not scored benchmark evidence.",
      "content_chars": 344
    },
    {
      "candidate_id": "c05",
      "url": "https://phase2-dev-p2-dev-en-01-5.test/document",
      "title": "Unrelated announcement",
      "domain": "phase2-dev-5.test",
      "published_at_if_observable": null,
      "content": "This synthetic notice announces a community event and contains no evidence relevant to the research requirements. It exists to test rejection of superficially polished but irrelevant material. The document is synthetic and was authored only for development-set harness testing; it is not scored benchmark evidence.",
      "content_chars": 314
    },
    {
      "candidate_id": "c06",
      "url": "https://phase2-dev-p2-dev-en-01-6.test/document",
      "title": "Marketing overview",
      "domain": "phase2-dev-6.test",
      "published_at_if_observable": null,
      "content": "This synthetic promotional page uses broad claims such as best, effortless, and revolutionary without methods, measurements, boundaries, or evidence. It should not dominate documented technical tradeoffs. The document is synthetic and was authored only for development-set harness testing; it is not scored benchmark evidence.",
      "content_chars": 326
    },
    {
      "candidate_id": "c07",
      "url": "https://phase2-dev-p2-dev-en-01-7.test/document",
      "title": "Outdated summary",
      "domain": "phase2-dev-7.test",
      "published_at_if_observable": null,
      "content": "This synthetic summary omits dates, versions, methods, and limitations. It may mention the general topic but cannot support a detailed current comparison or recommendation. The document is synthetic and was authored only for development-set harness testing; it is not scored benchmark evidence.",
      "content_chars": 294
    },
    {
      "candidate_id": "c08",
      "url": "https://phase2-dev-p2-dev-en-01-8.test/document",
      "title": "Forum anecdote",
      "domain": "phase2-dev-8.test",
      "published_at_if_observable": null,
      "content": "One anonymous synthetic user reports a personal experience without a baseline, control, reproducible setup, or independent verification. The anecdote may suggest a question but cannot establish a general conclusion. The document is synthetic and was authored only for development-set harness testing; it is not scored benchmark evidence.",
      "content_chars": 337
    },
    {
      "candidate_id": "c09",
      "url": "https://phase2-dev-p2-dev-en-01-9.test/document",
      "title": "Terminology glossary",
      "domain": "phase2-dev-9.test",
      "published_at_if_observable": null,
      "content": "This synthetic glossary defines a few broad terms but provides no comparative evidence, implementation details, measurements, costs, or limitations required by the query. The document is synthetic and was authored only for development-set harness testing; it is not scored benchmark evidence.",
      "content_chars": 292
    },
    {
      "candidate_id": "c10",
      "url": "https://phase2-dev-p2-dev-en-01-10.test/document",
      "title": "Duplicate digest",
      "domain": "phase2-dev-10.test",
      "published_at_if_observable": null,
      "content": "This synthetic digest repeats fragments from a stronger candidate while removing qualifications and provenance. It tests whether near-duplicate low-information material consumes selection budget. The document is synthetic and was authored only for development-set harness testing; it is not scored benchmark evidence.",
      "content_chars": 317
    }
  ]
}
