{
  "task_id": "p2-score-hr-05",
  "language": "hr",
  "domain": "science_health",
  "complexity": "moderate",
  "query": "Kako bi grad trebao upozoriti i zaštititi stanovništvo tijekom toplinskog vala? Sažmi rizične skupine, znakove hitnih stanja i praktične mjere za kućanstva i lokalne službe.",
  "requirements": [
    {
      "id": "r01",
      "text": "1. Identificirati skupine posebno izložene zdravstvenom riziku od vrućine."
    },
    {
      "id": "r02",
      "text": "2. Razlikovati upozoravajuće simptome od znakova hitnog stanja."
    },
    {
      "id": "r03",
      "text": "3. Predložiti praktične mjere za stanovništvo i lokalne službe."
    }
  ],
  "candidates": [
    {
      "candidate_id": "c01",
      "url": "https://www.who.int/news-room/fact-sheets/detail/climate-change-heat-and-health",
      "title": "Pending source 1",
      "domain": "who.int",
      "published_at_if_observable": null,
      "content": "PENDING VERIFIED PUBLIC EXTRACT FOR p4xe-7gva CANDIDATE 1. This placeholder is not valid benchmark content and must be replaced before input lock.",
      "content_chars": 146
    },
    {
      "candidate_id": "c02",
      "url": "https://www.who.int/europe/health-topics/heatwaves",
      "title": "Pending source 2",
      "domain": "who.int",
      "published_at_if_observable": null,
      "content": "PENDING VERIFIED PUBLIC EXTRACT FOR p4xe-7gva CANDIDATE 2. This placeholder is not valid benchmark content and must be replaced before input lock.",
      "content_chars": 146
    },
    {
      "candidate_id": "c03",
      "url": "https://www.who.int/europe/publications/i/item/9789289071918",
      "title": "Pending source 3",
      "domain": "who.int",
      "published_at_if_observable": null,
      "content": "PENDING VERIFIED PUBLIC EXTRACT FOR p4xe-7gva CANDIDATE 3. This placeholder is not valid benchmark content and must be replaced before input lock.",
      "content_chars": 146
    },
    {
      "candidate_id": "c04",
      "url": "https://climate-adapt.eea.europa.eu/en/observatory/evidence/health-effects/heat-and-health",
      "title": "Pending source 4",
      "domain": "climate-adapt.eea.europa.eu",
      "published_at_if_observable": null,
      "content": "PENDING VERIFIED PUBLIC EXTRACT FOR p4xe-7gva CANDIDATE 4. This placeholder is not valid benchmark content and must be replaced before input lock.",
      "content_chars": 146
    },
    {
      "candidate_id": "c05",
      "url": "https://www.ecdc.europa.eu/en/climate-change/climate-change-europe",
      "title": "Pending source 5",
      "domain": "ecdc.europa.eu",
      "published_at_if_observable": null,
      "content": "PENDING VERIFIED PUBLIC EXTRACT FOR p4xe-7gva CANDIDATE 5. This placeholder is not valid benchmark content and must be replaced before input lock.",
      "content_chars": 146
    },
    {
      "candidate_id": "c06",
      "url": "https://www.cdc.gov/heat-health/about/index.html",
      "title": "Pending source 6",
      "domain": "cdc.gov",
      "published_at_if_observable": null,
      "content": "PENDING VERIFIED PUBLIC EXTRACT FOR p4xe-7gva CANDIDATE 6. This placeholder is not valid benchmark content and must be replaced before input lock.",
      "content_chars": 146
    },
    {
      "candidate_id": "c07",
      "url": "https://www.cdc.gov/heat-health/about/heat-and-people-with-chronic-medical-conditions.html",
      "title": "Pending source 7",
      "domain": "cdc.gov",
      "published_at_if_observable": null,
      "content": "PENDING VERIFIED PUBLIC EXTRACT FOR p4xe-7gva CANDIDATE 7. This placeholder is not valid benchmark content and must be replaced before input lock.",
      "content_chars": 146
    },
    {
      "candidate_id": "c08",
      "url": "https://www.weather.gov/safety/heat",
      "title": "Pending source 8",
      "domain": "weather.gov",
      "published_at_if_observable": null,
      "content": "PENDING VERIFIED PUBLIC EXTRACT FOR p4xe-7gva CANDIDATE 8. This placeholder is not valid benchmark content and must be replaced before input lock.",
      "content_chars": 146
    },
    {
      "candidate_id": "c09",
      "url": "https://civilna-zastita.gov.hr/",
      "title": "Pending source 9",
      "domain": "civilna-zastita.gov.hr",
      "published_at_if_observable": null,
      "content": "PENDING VERIFIED PUBLIC EXTRACT FOR p4xe-7gva CANDIDATE 9. This placeholder is not valid benchmark content and must be replaced before input lock.",
      "content_chars": 146
    },
    {
      "candidate_id": "c10",
      "url": "https://meteo.hr/prognoze.php?section=prognoze_specp&param=toplinski_val",
      "title": "Pending source 10",
      "domain": "meteo.hr",
      "published_at_if_observable": null,
      "content": "PENDING VERIFIED PUBLIC EXTRACT FOR p4xe-7gva CANDIDATE 10. This placeholder is not valid benchmark content and must be replaced before input lock.",
      "content_chars": 147
    }
  ]
}
