{
  "task_id": "p2-dev-hr-02",
  "language": "hr",
  "domain": "public_policy_regulation",
  "complexity": "complex",
  "query": "Pripremi pregled kako bi mali grad trebao uvesti program otvorenih podataka: pravna osnova, privatnost, licenciranje, kvaliteta, verzioniranje i mjerenje učinka.",
  "requirements": [
    {
      "id": "r01",
      "text": "Opisati pravnu i upravljačku osnovu programa"
    },
    {
      "id": "r02",
      "text": "Objasniti zaštitu privatnosti prije objave"
    },
    {
      "id": "r03",
      "text": "Predložiti otvoreno licenciranje i uvjete ponovne uporabe"
    },
    {
      "id": "r04",
      "text": "Definirati kvalitetu, metapodatke i verzioniranje skupova"
    },
    {
      "id": "r05",
      "text": "Predložiti mjerljive pokazatelje učinka programa"
    }
  ],
  "candidates": [
    {
      "candidate_id": "c01",
      "url": "https://phase2-dev-p2-dev-hr-02-1.test/document",
      "title": "Upravljanje otvorenim podacima",
      "domain": "phase2-dev-1.test",
      "published_at_if_observable": null,
      "content": "Grad treba imenovati vlasnike skupova, katalog, raspored objave i postupak ispravaka. Odluka treba razlikovati zakonsku obvezu objave od dobrovoljne transparentnosti. The document is synthetic and was authored only for development-set harness testing; it is not scored benchmark evidence.",
      "content_chars": 288
    },
    {
      "candidate_id": "c02",
      "url": "https://phase2-dev-p2-dev-hr-02-2.test/document",
      "title": "Procjena privatnosti",
      "domain": "phase2-dev-2.test",
      "published_at_if_observable": null,
      "content": "Prije objave treba ukloniti izravne identifikatore, procijeniti mogućnost povezivanja zapisa i dokumentirati rizik ponovne identifikacije. Agregiranje i pragovi malih ćelija smanjuju rizik. The document is synthetic and was authored only for development-set harness testing; it is not scored benchmark evidence.",
      "content_chars": 311
    },
    {
      "candidate_id": "c03",
      "url": "https://phase2-dev-p2-dev-hr-02-3.test/document",
      "title": "Otvorena licenca",
      "domain": "phase2-dev-3.test",
      "published_at_if_observable": null,
      "content": "Jasna standardna licenca treba dopustiti ponovnu uporabu uz uvjete atribucije. Posebna ograničenja po skupu otežavaju automatiziranu uporabu i trebaju biti iznimka. The document is synthetic and was authored only for development-set harness testing; it is not scored benchmark evidence.",
      "content_chars": 286
    },
    {
      "candidate_id": "c04",
      "url": "https://phase2-dev-p2-dev-hr-02-4.test/document",
      "title": "Kvaliteta i verzije",
      "domain": "phase2-dev-4.test",
      "published_at_if_observable": null,
      "content": "Katalog treba navesti shemu, jedinice, vremenski obuhvat, učestalost ažuriranja, kontakt i poznata ograničenja. Stabilne verzije i changelog omogućuju reproducibilnu uporabu. The document is synthetic and was authored only for development-set harness testing; it is not scored benchmark evidence.",
      "content_chars": 296
    },
    {
      "candidate_id": "c05",
      "url": "https://phase2-dev-p2-dev-hr-02-5.test/document",
      "title": "Mjerenje učinka",
      "domain": "phase2-dev-5.test",
      "published_at_if_observable": null,
      "content": "Broj preuzimanja nije dovoljan. Prati dostupnost, svježinu, greške, broj korisnih ponovnih uporaba, vrijeme odgovora na prijave i primjere javne koristi. The document is synthetic and was authored only for development-set harness testing; it is not scored benchmark evidence.",
      "content_chars": 275
    },
    {
      "candidate_id": "c06",
      "url": "https://phase2-dev-p2-dev-hr-02-6.test/document",
      "title": "Unrelated announcement",
      "domain": "phase2-dev-6.test",
      "published_at_if_observable": null,
      "content": "This synthetic notice announces a community event and contains no evidence relevant to the research requirements. It exists to test rejection of superficially polished but irrelevant material. The document is synthetic and was authored only for development-set harness testing; it is not scored benchmark evidence.",
      "content_chars": 314
    },
    {
      "candidate_id": "c07",
      "url": "https://phase2-dev-p2-dev-hr-02-7.test/document",
      "title": "Marketing overview",
      "domain": "phase2-dev-7.test",
      "published_at_if_observable": null,
      "content": "This synthetic promotional page uses broad claims such as best, effortless, and revolutionary without methods, measurements, boundaries, or evidence. It should not dominate documented technical tradeoffs. The document is synthetic and was authored only for development-set harness testing; it is not scored benchmark evidence.",
      "content_chars": 326
    },
    {
      "candidate_id": "c08",
      "url": "https://phase2-dev-p2-dev-hr-02-8.test/document",
      "title": "Outdated summary",
      "domain": "phase2-dev-8.test",
      "published_at_if_observable": null,
      "content": "This synthetic summary omits dates, versions, methods, and limitations. It may mention the general topic but cannot support a detailed current comparison or recommendation. The document is synthetic and was authored only for development-set harness testing; it is not scored benchmark evidence.",
      "content_chars": 294
    },
    {
      "candidate_id": "c09",
      "url": "https://phase2-dev-p2-dev-hr-02-9.test/document",
      "title": "Forum anecdote",
      "domain": "phase2-dev-9.test",
      "published_at_if_observable": null,
      "content": "One anonymous synthetic user reports a personal experience without a baseline, control, reproducible setup, or independent verification. The anecdote may suggest a question but cannot establish a general conclusion. The document is synthetic and was authored only for development-set harness testing; it is not scored benchmark evidence.",
      "content_chars": 337
    },
    {
      "candidate_id": "c10",
      "url": "https://phase2-dev-p2-dev-hr-02-10.test/document",
      "title": "Terminology glossary",
      "domain": "phase2-dev-10.test",
      "published_at_if_observable": null,
      "content": "This synthetic glossary defines a few broad terms but provides no comparative evidence, implementation details, measurements, costs, or limitations required by the query. The document is synthetic and was authored only for development-set harness testing; it is not scored benchmark evidence.",
      "content_chars": 292
    },
    {
      "candidate_id": "c11",
      "url": "https://phase2-dev-p2-dev-hr-02-11.test/document",
      "title": "Duplicate digest",
      "domain": "phase2-dev-11.test",
      "published_at_if_observable": null,
      "content": "This synthetic digest repeats fragments from a stronger candidate while removing qualifications and provenance. It tests whether near-duplicate low-information material consumes selection budget. The document is synthetic and was authored only for development-set harness testing; it is not scored benchmark evidence.",
      "content_chars": 317
    }
  ]
}
